review,sentiment
"Oliver Stone is not one to shy away from a movie or theme for that matter. He is eager to confront people with their fears or show them their ugly faces in the mirror. Look on his CV for proof! This movie is not an exception, quite on the contrary, it is another gem, that unfortunately not many have seen.<br /><br />As controversial movies go, this is one that you should be thankful for. A movie that should encourage you to think about you, the people next to you. The prejudices that do exist and that everyone of us has in one form or another. Either we like to admit it or not, but it is easier to categorize people and be like ""Ah he's 'xyz', yeah he must be like ..."". Now I might be reading too much into it, but I don't believe that. I believe that Oliver Stone is a very intelligent filmmaker and that he was aiming for those things. And if that's something you want to explore (as a movie or within yourself), than watch this film and be excited!",1
"I bought this movie sight unseen at a sci-fi convention and I got what I deserved for doing something so silly. Simply put this movie is implausible, boring and unwatchable.<br /><br />I was so bored and disgusted with the lack of plot development that I turned it off to watch a repeat of Mythbusters. I understand that this was a very low budget move, or least it looked like a very low budget move, but that does not excuse the horrible acting, terrible plot and even worse camera work. It looks like something a group of college students did in between classes and getting drunk.<br /><br />Maybe if the villain wasn't so laughable and the plot was something that actually could happen in real life with respect to law enforcement it might become so bad it's funny. This movie isn't funny, it's just bad.",0
"I was a little to old for this show I was 6 when it first came out. First off when I was a young child there were a few children's shows that were on sesame street which I did watch and learned from, but other than that there wasn't much else. My Cousins were all born a few years after me 7 years was the first one more came latter. Barney was a very big part of what they watched. When I first saw this show I told my grandmother how it doesn't teach anything just uses magic to fix everything. I was 9 at the time, how many 9 years old have any idea what is really going on with a TV show. More and more that I saw or heard what the teachings of Barney were the more and more I told people how bad the show was. The funny thing is my parents who had a young child in the mid to late 80's which was me by the way. They agreed and said the same thing as I did. The sad thing about this is my cousins who are older now 13 and such still agree with what they saw. Its not cheating its creative, its not right to think differently than what someone tells you to. Its o.k to steal if the person wont find out or mind that it is gone. Lets be honest with ourselves, Barney is out to make money not teach children anything. The more flashy the program the more inclined children will be to watching it. Children are stupid not because they are not educated they just do not know any better, second Barney put on a show and parents bought it. I never believed that TV could affect people the way Barney does. If you have a young child read to them watch a show that teaches them numbers, do not let them get involved in this show. Barney is like smoking once is to much, smoke a few and your hooked let your kid watch this show they are hooked and one day their kids will watch the same crap and buy the same crap you bought",0
Definitely one of the most witty and twisted who-dunnit I ever seen. Christopher Reeve and Micheal Caine were brilliant and kept me going through the whole affair. <br /><br />Very classy set pieces and the props really lend a sense of atmosphere to the proceedings. The minimalist feel works for the whole picture.<br /><br />My only complain isn't with the film itself but the lack of a decent widescreen edition of the movie on DVD. I own the fullscreen version (which proves I love the film enough to endure fullscreen presentation) but a awesome Deluxe or 'special' edition would most surely get my cash.,1
"This film really disappointed me. The acting is atrocious. Unbelievable. And it's about actors. The story is incredibly obvious: A group of independent actors stage a Passion Play and, in turn, they start to live out the lives of the characters they play. I've been watching a lot of movies lately, thanks to Netflix, and this is the first one I haven't watched all the way through in a long time. I felt I didn't need to see the end; we all know the end of this story.<br /><br />For some, it seems, this ""modernization"" of the Gospels is either sacrilegious or enlightening. I cannot speak to any of this as I wasn't raised in the Christian church. That being said, I was raised in the US and I live in an increasingly Christian culture. I'm curious enough about Jesus and about the modernization of the religion, for better or worse. I haven't seen Mel Gibson's version, but I'm guessing that those who liked that one will like this, except for the most conservative. I just wish this was a better film.<br /><br />Lots of these reviews praise Arcand's direction and especially the cinematography. I liked neither. The film itself is rather prudish and preachy. I didn't believe the characters' personae and I was never involved with their on screen lives. The play within the play is very much dated and would not, I think, carry it's own weight in a real time production. But that's beside the point. What I really needed for this to work would have been stronger development of the characters and the plot to support the philosophical and theological questions the film would like to be about. And the musical choices are obvious and unoriginal.<br /><br />There were two examples of this that come easily to mind. Firstly, there is a reenactment of the parable of Jesus driving the money lenders from the temple: the lead actor, who has fallen for the woman who will play Magdalene and who is also a model and dancer, becomes enraged that she must debase herself by auditioning for a commercial (with a wicked producer and plenty of panting men in the audience) with her pants off. He trashes the place and chases them all out. I guess this is the level that the film wishes to reach. The romance between these two is entirely arbitrary and not at all emotionally realized and the scene is played out like a high-school rendering of Death of a Salesman, i.e., not well. Please stop hitting me over the head with this high-handed ""significance."" The other is the relationship between the other female lead and the priest who has asked them to do the play and who, eventually, turns against them and betrays them to the nowadays-corrupt Church. Why. Why does she sleep with this guy. ""It brings him so much pleasure and me so little pain."" Ah, the saintly whore and the lovable old coot. It seems to be just enough for Arcand to signify but not worth the trouble to enrich and enliven these characters. They are going through the motions and I'm reaching for the eject button.<br /><br />Feel free to write me off as bored, jaded or just not interested. Feel free to watch this movie and see the Passion, in all its beauty, sadness and inspiration, delivered as an amateurish and gimmicky charade. Feel free to have all your preconceived ideas affirmed and see any shred of artistic integrity forsaken for monotonous drivel. But don't say I didn't warn you.",0
"What is supposed to be a simple generic mystery plot involving a dead philanthropist is, in fact, a head-ache inducing tale about a bunch of characters (the only big actor being Ginger Rogers, in a very early role) all trying to find the murderer among a small cast of residents in a posh apartment building. These characters range from utterly stupid to downright mean. As a cheap, low budget production, most of the action revolves around Rogers and her lead man (some guy, I don't care who he is 'cause he really sucked) talking about their various possibilities of solving the crime, while being constantly cut off by an absurd detective with his head in his butt. Honestly, I've never had a worse time watching an old b-rate movie of this type, and I've seen some real head-slappers.<br /><br />Oh, and the butler didn't do it, because there wasn't a butler. But pay attention to the guy who's closest to a butler. There ya go.<br /><br />--PolarisDiB",0
"I really really love this show! I have always liked the 1990's shows of Space Ghost! This show was hilarious and I can't believe why Cartoon Network's Adult Swim would take such a funny show like this off the air. I hope they put this show on DVD or something. The show is about Brak (from the Space Ghost cartoons, SGCC and Cartoon Planet) who lives his every day life with his Mom and Dad and his best friend who likes to drop in a lot, Zorak! My favorite episodes were the one where Zorak gets this really good singing voice and then his voice doesn't give him any money that Zorak made from singing at all. Another episode I like is the one where Brak and Zorak didn't finish their homework and then they go back from Sunday to Friday and they just goof off and then they go back to the day homework was invented and then when they go back to the present homework didn't exist! Another episode I like is the one where Brak's Dad and their next door neighbor, Thundercleese the Robot keep getting into this agrument and then they get eaten by a giant worm. Another episode I liked was the one where Zorak makes a bully stand and then some new guy took over his stand. I also like a lot of the other episodes! One thing that never fails to make me laugh is when Zorak is getting beaten up, blasted and zapped!",1
"The 60´s is a well balanced mini series between historical facts and a good plot. In four deliveries, we follow a north American family, with 3 members. But we don't only see them. We also follow the story of several characters as a black reverend, an extremist student leader, and a soldier in Vietnam. The filmography is just extraordinary. In the first chapters, we see some shots of the Vietnam war, in between the scenes. The next chapter, doesn't start where the last one finished, it starts some time after, giving us a little mystery on what happened. In general, The 60´s mini series, is a must see, not only for hippies fanatics, but for everyone with little curiosity about the topic.",1
"Guys and Dolls is a unique play based on the characters. Sky Masterson<br /><br />(Marlon Brando) is a high-class gambler who takes up a bet with Nathan Detroit (Frank Sinatra) for one-thousand dollars. Nathan needs the money so he can<br /><br />run his usual crap game and make a fortune. The bet was that Sky wouldn't be able to take just any girl to Havana, Cuba and the ""doll"" he chose was Sarah<br /><br />Brown (Jean Simmons) who was in charge of a missionary. Sky finally bribes<br /><br />Sarah enough to go to Havana with him. They end up falling in love with each other, but later she accuses him of something he had no part in. Nathan ran a crap game in the missionary the night they were gone. Nathan's 14 year fiancé Adelaide (Vivian Blaine) disapproves of Nathan's gambling and tries to stop him from doing it. However, when the movie ends it all ends happy with a double<br /><br />wedding.<br /><br />The songs in this movie are just wonderful no matter who sings it. Marlon<br /><br />Brando has no singing voice at all and true they could have dubbed him but it didn't really matter. He did a wonderful acting job (obviously seeing as it's Brando) and played his character very well. I have seen a few movies with Jean Simmons and thought that this movie was her weakest one, she also couldn't<br /><br />sing at all. However, the singing is made up by Frank Sinatra, Vivien Blaine, and Stubby Kaye. Vivien Blaine and Stubby Kaye was also in the original<br /><br />Broadway production of Guys and Dolls. Vivien Blaine had a terrific voice and was the perfect Adelaide. If you like musical, and even if you don't, i advise you to watch this.",1
"""Don't Drink the Water"" is an unbelievably bad film. It's based on a 1966 Broadway play by Woody Allen. It stars Jackie Gleason, the comic genius behind ""The Honeymooners"". The director, Howard Morris, has appeared in several Mel Brooks comedies (Life Stinks, High Anxiety, Silent Movie)and has made a mark in animation (characters he has voiced include Gopher from ""Pooh"", Jughead (Archie)and Beetle Bailey) What went wrong?<br /><br />I think the problem is that the premise is played out too seriously to work effectively. Allen's original play was tongue-in-cheek, which is why it worked on Broadway and in Allen's 1994 remake. The screenplay by R.S. Allen and Harvey Bullock beats the premise to death and makes too many changes from the original play. Making Gleason's wife an airhead in this version when she was a headstrong woman in the original is just one example of why this doesn't work.<br /><br />The acting isn't much better. Gleason does the best he can with the material, but he can't save this. Gleason was a comic genius , but also a fine actor as he demonstrated in ""The Hustler"" and ""Soldier in the Rain"". His abrasive personality could have worked here, but the lousy script doesn't even give him a chance. Too bad. Estelle Parsons' airhead wife will drive you nuts after 20 minutes. See how soon it'll take for YOU to want to strangle her. That is also a shame because she is also a fine actress, having turned in two exceptional performances in ""Bonnie and Clyde"" and ""Rachel, Rachel"" None of the other actors do particularly well either.<br /><br />Woody Allen hated this film so much that he remade the film in 1994 with himself and Julie Kavner (Marge Simpson) in the leads. They manage to hit all the right notes and the film itself is a comic masterpiece. It's finally on video after a long battle over rights. Do go out and find that version. All the 1969 original is good for is clearing out unwanted guests who overstay their welcome.<br /><br />1/2* out of 4 stars",0
"In the opening scenes of this movie a man shot arrows through his hotel room into another man's bathroom and blew out all the lights. This must have been very hep for 1936, but rather way way out and had nothing to do with the film, Robin Hood did not make an appearance as far as I could see. However, Bette Davis(Daisey Appleby),""The Whales of August"",'87 was very young and attractive and performed one of her best roles in a long career in Hollywood. Daisey never stopped teasing or being very sexy with her nightgowns and so called swim suit on her yacht with George Brent(Johnny Jones),""The Spiral Staircase"",'46. Daisey even proposed marriage to Johnny in a Ferris Wheel upside down and even got a black eye. Davis and Brent made a great couple, one suppose to be very rich and the other a very poor reporter. Off stage, Davis and Brent were having a real torrid love affair, which is good reason why there was sparks when these two appeared in this film. If you liked Bette Davis and George Brent, this is the film for you!",1
"Definitely, definitely the worst film I've ever seen, no questions asked! Contradictors of this opinion might argue that this title should not be judged by the same criteria as others, since it's an independent, low-budget film, but c'mon already  the amateurism and meager innovation is horrifying.<br /><br />Agreeing with everything that has been said about this film, for example the mind numbingly weak acting (when it's this bad you take another go at shooting the scene, god damn it), the thing I found the most annoying was the total lack of common sense in the script, assuming such a thing existed during the production. There was an obvious absence of a dialogue with respect for the viewers, the girls switched personalities several times and they seemed to show absolutely no sing of any rationality or even brains - five relatively fit girls against one slight female psychopath  gang up on her, why don't you?<br /><br />The only thing that can be regarded as somewhat of a conquest for this title is the camera not leaving the van at any time thus the viewer seeing everything from inside it - which is, as the rest of the film, a good idea executed exponentially dreadfully.<br /><br />oh and by the way, this movie is NOTHING like The Blair Witch Project or Cloverfield or any other title filmed with a hand-held camera  this is an effect and not a trait! Used cleverly it can be breathtaking, but in this case it's an excuse for inadequate cinematography.",0
"I'll never understand why when a studio like Universal buys a musical it then butchers it when bringing it to screen. My first thought when seeing Ava Gardner and Robert Walker were starring I would be seeing something from MGM which did musicals best at that time. Boy was I wrong and disappointed.<br /><br />One Touch Of Venus which starred Mary Martin, Kenny Baker, and John Boles on Broadway ran for 567 performances in the 1943-1945 season and Gardner, Walker, and Tom Conway play the roles that Martin, Baker, and Boles did on stage. The Kurt Weill-Ogden Nash musical with book by Nash and S.J. Perelman was a comeback vehicle for Mary Martin who reestablished herself as the Queen of Broadway after a disappointing venture in Hollywood. <br /><br />Look at the names that went into this show. Given who was responsible for the book I expected to see some sparkling wit in this production. Instead I got a rather pedestrian screenplay, it was like all the wit was drained out of it. Doing her best to make up for it is Eve Arden playing her usual girl Friday role with Tom Conway, but it's even too much for Eve.<br /><br />The story concerns department store window dresser Robert Walker who kisses a very valuable statue of Venus who springs to life in the person of Ava Gardner. Of course when the statue goes missing, Conway yells for the law and is suspicious of Walker, the last person to be with the statue. <br /><br />The rest of the film is Walker dealing with Gardner and what will happen to both of them. For reasons I don't understand, Ava was of course dubbed by Eileen Wilson and Walker sings only a couple of lines. The singing is carried by Dick Haymes and Olga San Juan playing Walker's friends and coworkers. Of course on Broadway the songs were done by singers Mary Martin and Kenny Baker. You would kind of think that Haymes would be playing Walker's role at least. It was awkward to say the least.<br /><br />Only three songs survived from the score, Don't Look Now, But My Heart Is Showing, That's Him, and the incomparable Speak Low. Haymes's silken baritone is shown to best advantage in Speak Low which was sung as a duet by Martin and Baker on Broadway. For some reason the lyrics of one of the greatest men of verse of the last century, Ogden Nash, were done over by Ann Ronnell. I suspect the infamous Code was at work here.<br /><br />In Lee Server's biography of Ava Gardner he makes mention of a brief fling Ava had with Robert Walker when she had had a spat with her current man, Howard Duff. When Duff and Gardner reunited, Walker took it badly and didn't speak at all to Gardner off camera. I'm sure the fact that both of them were not in their best work didn't help matters either.<br /><br />Hopefully some repertoire company will do One Touch Of Venus and you'll get to see it the way, Weill, Nash, and Perelman wrote it.",0
"I am a Shakespeare fan, and I can appreciate what Ken Branagh has done to bring Shakespeare back for a new generation of viewers. However, this movie falls short of conveying the overall intentions of the play with the ridiculous musical sequences. Add that with Alicia Silverstone's stumbling over the dialogue (reminiscent of Keanu Reeves in Much Ado About Nothing) and other poorly cast roles, it all equals an excruciating endurance of viewing.",0
"I watched this film in shire joy.<br /><br />This is possibly one of the best films of all time. It has a timeless value, you can get so much out of it it's amazing. There are parts that are moving, funny, and just great.<br /><br />All aspect are spot on, the portrayal of the story is perfect, every detail is 100% genuine, even small Irish subtleties have been covered.<br /><br />The use of low and high shots gives two great views on Cristy (look out for that).<br /><br />Daniel Day-Lewis's performance is incredible. I've never seen an actor do that, ever. It really is amazing.<br /><br />And it's so great to watch, it flows so well, it's probably the closest thing yo can get to real life experience. I love it.<br /><br />If you haven't seen it, you should see it. Don't have any doubts on it, there is something there for all.",1
"I think this is what this movie wants us to say at the end of the movie! or Damn Australian? I still don't know, but what I know is that I really liked this movie but that couldn't be my favorite movie!<br /><br />Great story with great actors but with a terrible end... To make you cry and say 'Oh, she's so good'... Still, who made it? What really happened? Who's that guy? No answer to these questions...<br /><br />Mysterious movie with a good mark overall... I give it a 8/10, going on the 8.5!",1
"I was particularly moved by the understated courage and integrity of l'Anglaise, in this beautifully acted, intellectually and visually compelling film. Thank you so much, Monsieur le directeur Rohmer.",1
