review,sentiment
"I was excited to discover this late sixties comedy staring some of my favorite people - Maggie Smith, a very young Bob Newhart and, of course, Peter Ustinov. My disappointment was thus compounded to discover the film doesn't work as either a comedy or a perfect heist film. Ustinov plays a small time crook just out of prison who sets his sites on a large American corporation based in London. Bluffing his way past dimwitted CEO Karl Malden and tech geek Newhart, Ustinov passes himself off as a computer expert and immediately plans the 'perfect heist' part of the film. To do this he needs to get passed a tamper proof security system that guards the corporation mainframe. And here is problem one. His perfect plan only works because everyone else in the film is remarkably trusting and stupid. His lame excuses are taken at face value and this must be the only computer center anywhere not to bother with video cameras. The second problem is the heist (fraud really) happens within the first 30 minutes of the film robbing the rest of the picture of much in way of dramatic tension. Maggie Smith is sadly miscast as Ustinov's ditsy next door neighbor/secretary who just can't keep a job. I love Maggie Smith but she just seems too together here, too composed, the part called for more of a wacky, physical comedian. Furthermore, Ustinov and Smith have no chemistry together, maybe it's the age difference, but the later romantic relationship, as devoid of actual romance as it is, still comes off a little creepy. Ustinov co-wrote the script, and it was thought well of at the time, but I found it unfunny, meandering and a sad waste of a great cast.",0
"The brands in this film, like Suit Supply, take away from the story, cause it's supposed to be set in the eighties. It's not a very thrilling film. Also, the single from Intwine on the soundtrack is very bad, it has a chorus that is repeated numerous times', like ""I'm a cruel man, I take it all away, I'm a cruel man I'm here to stay.."" Jeeez couldn't those asswipes have come up with something better than that? I guess they wrote it in a couple of minutes..<br /><br />It's really annoying, just like the product placement in this filmproduct,that cashes in on the controversy and publicity around a criminal who should not be a celebrity like he is now made out to be, but should be forgotten like rats ought to be.",0
"<br /><br />""step aside for hollywood veterans?"" (the wayan brothers were 'asked') thats what hollyweird demanded and thats what it got. However, like so many of its recent decisions this one was a stupendous mistake.<br /><br />The director is SO out of touch with todays audience, attempting to bring back physical pratfalls and gags in place of funny dialogue is just a DISASTER. I knew it, the audience knew it and the CAST knew it.<br /><br />What a shame, why did they EVER consider changing directors? Not only that but the two Wayan brothers played as two of four primary characters, without them its just a farce and a sad one.<br /><br />SP<br /><br />",0
"Dad (78) and I (46) both had a good time watching the flick today. For a guy primarily known for serious roles, De Niro is a heckuva comic actor. Of course, it helps to have his past film images to play against. Consider that one of those roles, 15 MINUTES, was a cop having to deal with the interference of the mass media, and you have an interesting set of compare/contrast performances.<br /><br />Murphy plays another of his Axel Foley sort of characters. Shatner plays a burlesque of himself, a parallel world self who was best known for TJ HOOKER and not STAR TREK.<br /><br />It's interesting to watch how the film comments on the contrasts between the reality of police work and its fictional counterparts in TV and film. Shatner lectures on the proper means of sliding across a car hood; De Niro points out holsters scratch the hood finish. Ironically, as the film progresses, De Niro's character begins to incorporate the illusions of TV-cop reality into the real world case he's working.<br /><br />The film draws its inspiration from a gamut of sources, so one could make the comment it is derivative. Well, so what? Satire needs to derive its humor in order to exist. And besides, the film does have quirky moments of originality. For example, I'm reasonably sure the method of the villain's death has never been done before. <br /><br />One quibble about the reality of the weapons involved-- shouldn't those guns have had some kind of recoil? In order to penetrate steel, those bullets had to have enough inertia to penetrate. And any bullet's highest level of inertia is at the moment of firing. So.... firing a volley of these tank-killer bullets should have driven the shooters back onto their butts. Oh, what the heck... it's a satire. Maybe the guns' lack of recoil is itself a satire on the B-F-Guns used so casually in thrillers. <br /><br />",1
"THE ATTIC starts off well. The somewhat dreary story is helped greatly by the two main actors and there's a semblance of a character study going on here but the film goes downhill fast when Carrie Snodgress' character buys a monkey. Not one of those cute little monkeys. She buys a real big chimpanzee!!!<br /><br />This sudden plot device basically kills the movie. It's just not conceivable for a woman like the one Snodgress plays, who has a hard time doing anything because of her domineering father, for her to, out of the blue, buy a chimpanzee. I mean, come on! Forget about it!",0
"Brian Keith as Cole Wlikerson and Richard Jaeckel as Wade Matlock make excellent villains. They just love intimidating the locals in the most brutal way possible, and sneer sexily at any suggestion that there might be a more humane way to achieve their ends. It's a pity that goody-goody Glenn Ford gets in their way.",1
I can't get over how lazy the director is with this movie. Instead of setting up scenes in a creative way he relies on boring old zombie clichés.<br /><br />Where the two unarmed leads have to get down the college steps into the van he surrounds them with zombies yet neither of the leads is bitten. He can't be bothered to direct a decent fight scene so we see the leads shove their way down the steps.<br /><br />Sometimes the zombies limp about and at others they run like the wind. This is really convenient for the director because he can set up anything he likes without bothering with continuity in the behaviour of the zombies.<br /><br />With careful planning and a lot more inspiration this movie could have been so much better.,0
"Doll Master is an example of a lousy horror film, fallen somewhere in the space with it's two not so well established genres, a horror film and an emotional drama film. Seems like The Doll Master tries very hard to be a very scary horror film, but it fails. The noise of the dolls while moving is like taken from the croak of Kayako in Ju-On, and the crawls are like sadako esquire. The killing dolls will remember you a cute version of ""Chucky"". But compared to Child's Play, this film is more superb. But the story seems a nothing, the brilliant camera shots and the brilliance of acting was taken away cause of the plot.<br /><br />Don' watch this if you are expecting great shocks.",0
"Long, boring, blasphemous. Never have I been so glad to see ending credits roll.",0
"Awesome Movie! Great combination of talents! I'm a HUGE fan of David Duchovny and he is outstanding in this movie! I would love to see him in more movies of this nature. His talents are definitely under-used and has SO much more to offer besides ""Agent Mulder"" (although I'm a huge fan of that series too), Anyway, I want to see more of him. He is easily the Cary Grant of our generation. If you haven't seen this movie, you MUST! Great love story that shows love never dies... it's with you forever. Minnie Driver is great and how can you go wrong with a cast containing Mr. O'Connor and Mr. Loggia and Mr. Belushi? This movie didn't get any type of awards nod, but deserved one. Great job Bonnie Hunt! ** By the way... the soundtrack is great too! **",1
"This is one of the funniest movies I have ever seen. If you know the Real World and the people from those shows, this movie will be top notch, if you have never seen the real world you will still think it is an extremely funny movie but you won't get some of the inside jokes about the actors and the tv show.",1
"This movie is a waste of time and money. Throughout the entire hour and a half, I continued to wait for it to get better and it never did. It was slow moving, the plot jumped around, it wasn't scary or interesting, and really never amounted to anything. The credits during the introduction were long and drawn out, which was basically like the rest of the movie (long and drawn out). Numerous parts of the plot made no sense. Several times during the movie I had thought that maybe I had ""zoned out"" because the incongruity of the plot, however, my companion had the same issue and assured me I did not ""zone out"" from boredom, but it was indeed the movie. I've actually never posted on here about a movie before and have been actively looking up movies on IMDb for numerous years. So the fact that I'm actually taking the time to write something should speak volumes of how bad this movie is and that you should not waste your time or money on it.",0
"When you go at an open air cinema under the Greek summer night you usually don't care what the movie is! Edison started really good with some good effort from the singers-who-want-to-be actors and a once again great Morgan Freeman but... (In a movie there is usually a good start to catch audience,done, a bit boring yet story filling middle of the movie that is more about characters and less about action ,done, and the third part is something really good so that you can remember the movie...) when you see 30 elite police officers (packed with weapons that can demolish a building) shoot at a guy behind a car, fail to hit him even once while he kills all (but 3) and then the guy takes out a flame thrower (to kill the rest 3) ,you realise that the Greek summer sky filled with stars is way too good to be distracted by a movie like this!",0
"This is a great British film. A cleverly observed script with many quotable lines, which captures perfectly what magic mushrooms can do to a man over a weekend. As per usual Phil Daniels is excellent along with that most under rated of British actors Geoff Bell. Peter Bowles with a joint hanging out of his mouth is a casting masterstroke and Gary Stretch with his brooding looks brings something strangely atmospheric to the piece. Although it seems to be billed as a biker movie, i think it will find an audience outside of this, purely on the premise that a lot of people have been there done it and got the t-shirt. also A great original soundtrack with a blinding version of Freebird. This really could be a 21st century heir to the famous Ealing comedies. Like the weed in the Welsh fields: it's a grower!",1
"****SPOILER ALERT**** All throughout Australia the summer turned into a deluge of rain and hail stones the size of baseballs that was causing havoc in coastal cities like Sydney. It's under these hectic conditions that tax lawyer David Burton, Richard Chamberlain,got involved in a case, as a defense attorney, involving the death of a local aborigine who was found dead outside a Sydney bar. <br /><br />Having five fellow aborigines arrested for Billy Cormans,Athol Compton, death it's determined by the police coroner that Billy died of drowning not by violence even though he had bruises on his neck and shoulders. Yet the court decided to prosecute the five for his death charging them with manslaughter instead of murder.<br /><br />David defending the five gets no help from them in their defense with the accused assailants opting to remain quite and keep what happened to Billy to themselves and take what's coming to them from the court. One of the defendants Chris, David Gulpili, begin to somehow invades David's dreams as if he want's to tell him what was really behind Billy's death.<br /><br />David at first not taking his dreams of Chris seriously begins to sense that their real when he meet him at the courthouse. Chris confirms David's dreams by showing him a strange looking black rock that David saw Chris have in his dreams. Later meeting Chris and, what turns out to be an aborigine shaman, Charlie (Nandjiwarna Amagula) who came to his house that evening David is told that he, like Charlie, has spiritual powers that he inherited from his mother's grandfather. Those powers will reveal to him the future that has to do with the strange weather conditions that are flooding the Australian continent. The earth,Chris tells David, is going through a gigantic cleansing cycle with the old world about to be washed away and the new world ready to take it's place.<br /><br />David is confused about what both Chris and Charlie are telling him but as the rains continue to increase and the ocean waves start to rise he feels that something terrible is going to happen. David want's to know if it's all aborigine folklore or there's some scientific facts, or logic, behind their end of world-like revelations.<br /><br />By now it's obvious that both Chris and Charlie are members of an aborigine tribe right in the heart of modern Sydney. That alone can get Chris off, as well as his four friends, for the murder of Billy. Since the Australian government will not prosecute tribal aborigines, leaving any justice to be done by the tribes themselves. Still Chris refuses to admit he's a member of a native tribe and he and his four friends are convicted of manslaughter in Billy's death with the sentences to be handed down by the judge within days.<br /><br />David now determined to find out what was the reason for Chris' silence, and why Billy had to die, is taken by Chris to the scene of the crime. It's there that David finds out that Billy betrayed Chris' tribe members by going there with Billy not being a member of Chris's aborigine tribe. It's also revealed to David that he himself has some kind of spiritual connection with the Austrailan aborigines as both Charlie and his step-father Rev. Burton,David Parslow, told him. <br /><br />The stage is now set for the great and final cleansing cycle that David's been seeing in both his night-time dreams and day-time visions. It comes in the form of a massive tidal wave rolling out of the Pacific Ocean into the Australian coast city of Sydney and then submerges the entire continent.",1
"The movie is good and I think Tiffany Amber is very beautiful. I liked the movie. Can anyone tell me how I can get hold of the songs from this movie? Even the soundtrack will do. If that's not possible, can I at least get the names of the songs with their respective singers? I tried to look up amazon.com but its not there. I tried CD baby, not there either. I browsed through Google to get some details but there weren't any. I would appreciate it if someone could give me the answer to my question. I know that the songs belong to Country Music and is sung by a country artist. I just need the title names along with the singer. I would recommend this movie or rather the songs to any country loving person.",1
"the film itself is absolutely brilliant, its that buzz, that rush that makes you just want to go out, blow your wages and loose yourself. It's what the weekend is all about, its our sanitation where we can come together as one and be ourselves without a care in the world. The film is layered in depth and the dialogue in places is just spot on, especially with Jip. The characters themselves are instantly likable, one in particular is obviously dyers character and his views on what ""Star Wars"" is really about, genius.<br /><br />If ever you've got an hour to kill before going out, stick on this, you'll immediately feel yourself growing in confidence, definitely recommend it.",1
"Yowsa! If you REALLY want some ACTION, check out the babes and bombs on this non-stop thriller! Veteran star MARTIN SHEEN leads a trio of supermodels on a mission to stop nuclear terrorism... but director Dean Hamilton doesn't let this heavy plotline get in the way of massive doses of TEENSY-SWIMSUIT scenes, jiggly beach jogs, hubba-hubba hot tubs and the like! Want action? You'll get more of it here than in PEARL HARBOR. Want babes? You'll get an eyeful every two minutes. Want more? Go out and BUY THIS VIDEO! Yowsa, Yowsa, Yowsa! That's some mighty spicy meatballs!!!",1
"This BBC series is excellent. I am no Paleontologist, but this series gives the best historical representation of dinosaurs I have ever seen. The 3D animation and animatronics are very good and make you believe you have travelled back in time. The BBC deserves a pat on the back for such a fine series as well as Tim Haines who must have spent a great deal of time getting this series to air.",1
"How can anyone argue the fact that Urban Cowboy was, and still is, the best document of Texas life for the time period. Consider the following: men beat their wives, get drunk at bars nightly, get married to settle a fight, commit adultery, and compete on mechanical bulls. Try and name a movie that depicts real life so vividly. They dont make them anymore. It seems current films are always about people with lots of money, they live in huge homes, drive expensive cars and don't work. This movie has a celebration scene about getting a trailer for pete's sake !<br /><br />Anyway, I watch it at least once a week. No kidding. I have dissected this movie from end to end. feel free to email me to learn more about my reason for calling it a documentary. Consider the following scenes: Bud sees Sissy - they are split up - he amicably honks and waves, she flips him the bird - he returns half the peace sign honking his horn to add impact then tears off.<br /><br />Buds mom calls him approx. 18 hours after he gets into town, on a Sunday, to see if he has a job yet - all he has accomplished is getting drunk and laid(x2), with help from his uncle and aunt who cover for him.<br /><br />""You all live like pigs"" Think about why this scene is needed. Think about it. Was it necessary ? Could we not figure it out without showing the filthy sink ? God I love that !<br /><br />Sissy allows Wes to help her ride the bull. Only a few days (or possibly the next day) after Wes just kicked the crap out of her husband. Steve asks - Hey Sissy, remember Wes ? Oh yeah, didnt you beat my husband up the other night, so let's get this lesson goin', to make no mention of the fact that she seeks solace in him later during one Bud and Sissy's many fights, which by the way all take place in public - in Gilley's !<br /><br />The Wedding reception picture taking session (oh the humanity !) could they at least arrange or move the chairs out of the way. ""My legs are sweatin' momma""<br /><br />In conclusion, you don't put scenes like this in a movie to try and show insight into human psychology. It is a documentary of real life.<br /><br />I only wish there was a director's cut....",1
"If you decide to watch Wild Rebels, don't expect anything deep and meaningful. If you're looking for a film that explores the relationships and structure of a motorcycle gang, Wild Rebels is the wrong movie. If you're looking for an expose on the breakdown of the American educational system and the problem of juvenile delinquency, Wild Rebels is the wrong movie. If you're looking for a movie that examines how undermanned rural police departments are when facing a well-financed, well-organized gang, Wild Rebels is the wrong movie. But if you're looking for an absurd movie filled with scene after scene of unintentional humor, horrendous acting, a paper-thin plot, and community theater style production values, Wild Rebels is the right movie.<br /><br />Wild Rebels is the story of a down-on-his-luck stock-car driver named Rod Tillman (Steve Alaimo). After a fiery crash (which Rod walks away from completely unscathed despite having only a cotton pants and a London Fog style jacket for protection), Rod decides to give it up. With no plan for his future other than to wander aimless through the back-roads of the South, he stumbles on the Satan's Angels motorcycle gang (a gang being three of the stupidest guys to ever zip up a leather jacket and a woman they seem to share). This group of hoodlums spends their time terrorizing a rural town in Florida by committing such atrocities as stealing a newspaper from a neighbor's mailbox. These bumbling idiots need someone to act as their driver during some larger crimes they have planned. Apparently, these three Einsteins can only drive vehicles with two tires, not four. So they recruit Rod to perform feats of daring that only an experienced stunt driver would be capable of like keeping the car in the middle of a gravel road during a low-speed chase. Eventually, they hold-up a bank, get into the aforementioned low-speed chase, and have the lamest gun battle with the police ever put on film. I could go on forever, but you get the idea.<br /><br />I hate the term ""so bad it's good"", but that seems to aptly describe Wild Rebels.",0
"Okay, you have:<br /><br />Penelope Keith as Miss Herringbone-Tweed, B.B.E. (Backbone of England.) She's killed off in the first scene - that's right, folks; this show has no backbone!<br /><br />Peter O'Toole as Ol' Colonel Cricket from The First War and now the emblazered Lord of the Manor.<br /><br />Joanna Lumley as the ensweatered Lady of the Manor, 20 years younger than the colonel and 20 years past her own prime but still glamourous (Brit spelling, not mine) enough to have a toy-boy on the side. It's alright, they have Col. Cricket's full knowledge and consent (they guy even comes 'round for Christmas!) Still, she's considerate of the colonel enough to have said toy-boy her own age (what a gal!)<br /><br />David McCallum as said toy-boy, equally as pointlessly glamourous as his squeeze. Pilcher couldn't come up with any cover for him within the story, so she gave him a hush-hush job at the Circus.<br /><br />and finally:<br /><br />Susan Hampshire as Miss Polonia Teacups, Venerable Headmistress of the Venerable Girls' Boarding-School, serving tea in her office with a dash of deep, poignant advice for life in the outside world just before graduation. Her best bit of advice: ""I've only been to Nancherrow (the local Stately Home of England) once. I thought it was very beautiful but, somehow, not part of the real world."" Well, we can't say they didn't warn us.<br /><br />Ah, Susan - time was, your character would have been running the whole show. They don't write 'em like that any more. Our loss, not yours.<br /><br />So - with a cast and setting like this, you have the re-makings of ""Brideshead Revisited,"" right?<br /><br />Wrong! They took these 1-dimensional supporting roles because they paid so well. After all, acting is one of the oldest temp-jobs there is (YOU name another!)<br /><br />First warning sign: lots and lots of backlighting. They get around it by shooting outdoors - ""hey, it's just the sunlight!""<br /><br />Second warning sign: Leading Lady cries a lot. When not crying, her eyes are moist. That's the law of romance novels: Leading Lady is ""dewy-eyed.""<br /><br />Henceforth, Leading Lady shall be known as L.L.<br /><br />Third warning sign: L.L. actually has stars in her eyes when she's in love. Still, I'll give Emily Mortimer an award just for having to act with that spotlight in her eyes (I wonder . did they use contacts?)<br /><br />And lastly, fourth warning sign: no on-screen female character is ""Mrs."" She's either ""Miss"" or ""Lady.""<br /><br />When all was said and done, I still couldn't tell you who was pursuing whom and why. I couldn't even tell you what was said and done.<br /><br />To sum up: they all live through World War II without anything happening to them at all.<br /><br />OK, at the end, L.L. finds she's lost her parents to the Japanese prison camps and baby sis comes home catatonic. Meanwhile (there's always a ""meanwhile,"") some young guy L.L. had a crush on (when, I don't know) comes home from some wartime tough spot and is found living on the street by Lady of the Manor (must be some street if SHE's going to find him there.) Both war casualties are whisked away to recover at Nancherrow (SOMEBODY has to be ""whisked away"" SOMEWHERE in these romance stories!)<br /><br />Great drama.",0
"Where oh where to begin in describing the comprehensive wretchedness of Neil LaBute's latest attempt at film making? <br /><br />There are many kinds of film fans out there, but by far the most annoying and shallow is Mr. Intriguing. You know Mr. Intriguing, don't you? <br /><br />He's the fellow that no matter how stupid, lame, and incomprehensibly dull a film is, he says ""Gee, I don't know why everyone hated it, I found it intriguing."" He's the kind of guy who finds the scent of dog poop intriguing. Especially when he smears it in the shape of a Hitler mustache on his upper lip and marches about the house ranting about the brilliance of science fiction that features thinly veiled references to Greek mythology. He's also the guy this version of The Wicker Man was made for. No one else could stand it.",0
