review,sentiment
"Dolph Lundgren stars as a former cop/boxer who searches Boston's kinky scene to find out who killed his brother,who was well thought of in the community, however along the way he learns how his brother enjoyed kinky sex and that a serial killer is to blame. Dolph Lundgren is very good in this movie, in fact on the basis of his performance here, one would forget Lundgren's rise to fame involved action roles. That said the material gives Lundgren nothing to work with, in fact, Lundgren is completely left out to dry in a dreary thriller which is both predictable and incomprehensible. Co-Star Danielle Brett is also good, in fact the film works best when it centers around the chemistry of Lundgren and Brett, indeed had the film taken the time to explore their relationship the film would've been fairly decent. However the movie is lackluster, the action is non-existent, the plot not given enough exploration (Too much boring B.S around Lundgren's investigation of his brother's employer) and the film is needlessly gory and ridiculous. Once again, Lundgren is actually really good (As is newcomer Danielle Brett) but the film just lumbers from one sequence to the next, which makes this movie particularly disappointing. If anything else though, it shows how underrated Lundgren is, as an actor.<br /><br />*1/2 Out Of 4-(Poor)",0
"Brought Philip Larkin to life in a way that is worthy of the greatest performances of all time, and not just the ones that are measured by popularity. It shows a stark portrayal of Larkins life as the greatest unrecognized poet of his era - which is exactly how he would have wanted it, such was his disdain for cankers and medallions. It dramatically exposes the raw beauty in the intense sadness of Philips observations of our relationship with our own mortality, and lays it our in a way that seems to have missed even the great philosophers. for anyone interested in profound observations of our relationship with life, love and death this is a must.",1
"I saw the trailer for this film before watching Titanic, and I must admit that it whetted my appetite. Volcano seemed to be quite spectacular and full of promise. But what a damp squib. Corny is not the word for the script, and the characterizations are often ludicrous. The stupid daughter is just beyond belief - she is supposed to be 13 not 4. But then the scientists,firemen and peripheral characters don't offer any more. This movie ranks just in front of Cruise II and Twister, but only because those 2 films are completely appalling. This does have some reasonable effects, but overall its a 1 out of 10. Don't waste your time",0
"This is the epitome of bad 80's film-making, unless you are a pre-pubescent girl. Riding on a big name like madonna, a story line that physically assaults one's intelligence and humour that is most suited for a nursery school. If there was ever any doubt i think this turd of a movie clearly displays Madonna's absolute lack of acting talent and made me feel highly embarrassed on her behalf. The only thing i can't believe is that they ever let the director near another movie again. Madonna spends most of the movie prancing around like an infantile rag doll, and talking like a baby. It is painfully obvious that the only reason this movie was ever made was due to the fact that Madonna was a big name in pop music at the time. DO NOT BE DUPED INTO SEEING THIS AWFUL ATTEMPT TO CASH IN ON POP STARDOM. Stay away at all costs!",0
"As hard as it is for me to believe, with all of the awful reality shows out there over the past few years, this one has to take over the top spot for worst one yet. I am still wondering if this was actually just a spoof done by the SCTV gang. If Andy Kaufmann were still alive I'd be sure he was behind this. Can a rock band stoop any lower than has INXS to do such a shameful thing as this? The premise is simple and moronic. Audition a bunch of karaoke rejects to become the new lead singer of INXS, to take the place of Michael Hutchence (who committed suicide in 1997). Eight years and no hits later, the band commit the ultimate act of patheticness by subjecting themselves to auditioning a bunch of talentless wannabes to be the new lead singer of a band that is 20 years past its prime. So they trot all of these awful singers (I thought American Idol had its share of doozies) who do atrocious renditions of just about every classic (and predictable) rock song imaginable. And then they cut to the INXS band members who are seriously discussing the merits of each of these candidates. You could see better (and more original) rock performers at just about any night club in any city in the world.<br /><br />It has all the usual uncreative elements of every other reality show. Lame reality participants, lame interviews, lame host/emcee, lame ""judging"" of performances, and the lame booting of one participant at the end of each show. Can these shows get any more predictable? It's clearly a publicity stunt on the part of the band; a last gasp of hope at rekindling their lost stardom before they are finally buried into oblivion. Michael Hutchence, if he had any shred of dignity when alive, has to be rolling over in his grave. Not that INXS were ever a great band, but I had no idea they were this pathetic. If INXS are at all representative of what rock and roll has become, this show would be the final proof that rock and roll is once and for all, dead.",0
"I`ve seen this movie twice, both times on Cinemax. The first time in it`s unrated version which is soft-core porn at it`s best and the second time in a trimmed down (cut all the sex and most of the nudity out) version which was entertaining in a typical beach movie sort of way. The unrated version has a tremendous sex scene with Nikki Fritz, a dude and a bottle of oil which is out of this world (no pun intended). Unfortunately, in the trimmed version that scene is almost completely chopped out, as are all the other sex scenes. Rated or unrated it is still fun to watch all the siblings of bigger stars (Stallone, Sheen, Travolta, etc;) trying to act. We also get appearances by B-queen Linnea Quigley and Burt Ward (Robin from the old Batman series).",1
"Apartmente'L is one of the most interesting movies that I have ever seen. I experienced extreme frustration while watching this movie as I was gunning for the two leads to reunite. That never happened in the end which disappointed me to no end. But the ending lends an even more cynical touch to a generally cynical movie. It is not a movie which people are likely to rewatch but one watch itself will have a deep impact on people. As of now I haven't rewatched the movie and I don't think I will.<br /><br />The story follows the experiences of a man, Max, who is engaged to be married to Muriel. He remembers his old girlfriend Lisa(he considers this the love of his life) as he listens, by accident, to Lisa talking on the telephone. Thus he tries to find Lisa. Here starts his extremely frustrating search for Lisa. There are many layers to this movie. There are undercurrents of jealousy, vouyeurism and so on. There is also another character called Alice who is involved in the whole confusion. The movie then moves through a whole range of twists and finally leads to an ending which could be interpreted in many ways. It is fascinating how this movie has only four main characters but the clever writing makes it interesting and unique. What I love about the fact is that a movie about obsession, jealousy is done in such a light hearted manner. It has a very fast pace which is probably the reason why it can appeal to a large audience. The main character, Max, has shades of grey and I felt the ending was perfect. I don't think he is supposed to be a clean character considering the fact he is searching for his long lost love while he is engaged and he also has a fling with Alice.<br /><br />The character of Alice is even worse. Her manipulation and her compulsive lying can really irritate viewers(that is the point, I guess). The scene where she breaks down in front of Lucien really shows another facet of her character. It shows a side of her that wants to be accepted and that she is tired of all the lying and the games and she wants to lead a normal life. In the end, she understands that she needs to get away from it all. The ending lends a cynical touch. Because it seems as if Max's love for Alice is temporary and fake. It is as if to say that love in general is a temporary emotion and it is better to choose the safe option(i.e Muriel) than to pursue something that is so fleeting(i.e Lisa or Alice). In many ways this is not really a romantic movie but a satire about romance(in a way).<br /><br />The performances deserve high praise. Vincent Cassel as Max gives a great performance. He perfectly portrays the confusion of a man who is not really sure about his engagement. His geeky looks are an added advantage as it fits the character perfectly. But the real star of the movie is Romane Bohringer as Alice. Her nuanced portrayal of a woman who is jealous of Alice and is in love with Max. The scene where she screams ""I am a nutcase too"" really shows her desperation and her yearning to live a normal life with a man who loves her.<br /><br />Btw I also thought lesbianism is another interpretation that can be drawn from this movie. Alice's actions can be explained in many ways. And her unreasonable obsession with Lisa may also be explained as a manifestation of a lesbian desire. It may be far-fetched considering she encourages Lisa to forgive her current boyfriend. But I got the feeling that she was a lesbian for a long time. She also avoids questions from Lisa regarding a boyfriend. She spends a whole lot of time with Lisa and she is happy during that time. That may lead many to question her sexual orientation.<br /><br />Overall I would give it a 9/10. I think it deserves it but I subtracted one because of the rewatchability factor. I think it is a perfect movie otherwise.",1
"'The second beginning' as it's title explains, shows us the beginning of the end for the human race. Set long before the matrix existed, this short anime written by the Wachowski's shows us the world that could lay infront of us in the not to distant future, set at the turn of the 21st century, the second renaissance delves into issues common with human behaviour; greed, power, control, vanity etc.<br /><br />The use of robots or artificial intellegence as slaves or servents is common among science fiction/fantasy stories. The second renaissance is no exeption to this concept, however instead of a simple man vs. machine layout, this story explains the struggle that the machines put up with, the struggle for acceptance in a world ruled by humans. Where the matrix films show us the human perspective, these short animations tell both sides of the story.<br /><br />The second renaissance part 1 + 2, answer many questions brought up by the original Matrix film, such as how the war broke out, how the sky was blackend, what led to the use of humans as batteries and it also introduces us to the machine city called 01, which may have relevance to the upcoming Matrix Revolutions film.<br /><br />I won't give away too much of the story, as I do not want to ruin the experience for perspective viewers, however, I will recommend it to anybody interested in the world of the matrix or simply anybody interested in Japanese animation (anime).<br /><br />9/10.",1
"It's too bad these guys, the so-called judges, are such jerks, even the nominally ""sensitive"" ones. It's the self-congratulatory tone that really makes me sick though; these guys don't have any perspective on their behaviour. I think the real problem, though, is the quality of the contestants. Not a single smooth or truly charming one in the lot. They pick the most pathetic girls out of the crowd because they're the only ones these guys have a chance with. Let's see some real players trying for a truly unattainable girl, and maybe you have a show. Otherwise, you have a revolting half-hour of self-love. And real sexual tension takes two.",0
"I saw this movie on Thursdays night after having a really boring day. I had no expectations, those I had were rather negative. Being that the only movie I've ever watched Jimmy in is the American version of Taxi with Queen Latifah(?)...don't ask why! But seriously..this movie is so cute! Drew Barrymore is always sweet, but I almost fell in love with Fallon's character. Why can't I meet a cute nerd like that. :) Movies like that are excellent. Simple, sweet and necessary. Sunday on a Thursdays. I'm not even a sports fan, but it's something about American movies with baseball that fascinates me. Probably the fact that we don't have that sport here in Norway.<br /><br />(My first comment ever.) Haha",1
"This production is an insult to the Stooges, especially Moe. It is inaccurate and poorly acted. Many of the events depicted just didn't happen that way and too much was left out or skipped over. Read the books written by Moe and his daughter Joan instead. This was a waste of time.",0
"Along with Fernando Fragata, João Mário Grilo, Abi Feijó, Leonel Vieira, étc...(other commercial directors), Diamantino Costa is one of the best Portuguese Directors; ""O Lampião da Estrela"" was his (Diamantino Costa) First movie, before he made several successful commercials. This title is starred by one of the best Portuguese comedians of all times, Herman José and José Pedro Gomes are great. Its a very funny movie!! (28/07/2000)<br /><br />BOA SORTE DIAMANTINO...",1
"A lonely depressed French boy Mathieu (Jeremie Elkaim) on vacation in the summer, meets and falls in love with Cedric (the gorgeous Stephane Rideau). Quiet and slow this is a very frustrating movie. On one hand, I was absorbed by it and really felt for the two boys. On the other I was getting annoyed--the film constantly keeps flashing around from the past to the present with no rhyme or reason. It's very confusing and pointless. <br /><br />SPOILERS AHEAD!!!<br /><br />Also there are tons of plot holes--Mathieu, at one point, does something that ends him up in the hospital. What is it--we're never told! Then he breaks up with Cedric and tells everybody else he's living with him. Why? We're not told. Then he hooks up inexplicably with another guy at the end. Why? No explanation. It's clear Cedric loves Mathieu and Mathieu is living in the same town so... However it is a tribute to the film that you really care about the characters so much. If only things were explained!<br /><br />Elkaim as Mathieu is not good. He's tall, handsome and has a nice body--but he can't act. His idea of acting is sitting around with a blank look on his face--all the time. Rideau, on the other hand, is great. He's VERY handsome, has a very nice body and is one hell of an actor. Also he has an incredible sexual magnetism about him. There is full frontal male nudity, lots of kissing and a fairly explicit sex scene in the movie which is great--most movies shy away from showing male-male love scenes. This one doesn't and it helps to see how the characters care and feel for each other.<br /><br />So, a frustrating film but somewhat worth seeing--especially for Rideau's nude scenes--that is, if you like good-looking nude young men!<br /><br />",1
"Well, this movie actually did have one redeeming quality. It made up the funniest season one episode of MST3K. I wish Rhino had released this one instead of ""The Crawling Hand.""",0
"Men, do I love police movies filled with action, shooting, chases etcetera.<br /><br />Boy, was I let down after watching this short and unsatisfying movie. We've seen it all before, the hostages, the bank, the surrounding... Yet, 2 bad guys that shoot down multiple officers and innocent people who simply stay in the line of fire - without getting hit due to some Kevlar.<br /><br />Not just a few shots, no, hundreds of shots. Going back into the bank, where the dumb hostages didn't lock the safe or doors when the bad guys went out. How stupid did the director think we'd be.<br /><br />Okay, the shots in between that fake a documentary were good, but after seeing the film I only got the thought: why didn't the police get a decent shooting course? And why where there so many cops and was SWAT on a real long break. Truly bad.",0
"This is one of the best and moodiest Vampire Tales ever! I love this movie really. The character are great, even the locations and the story. Indeed the Picture isn't a big budget production, but it is absolutely worth seeing.<br /><br />OK there are some faults (especially the Names of the Castle and the Locations) in this movie, but such mistakes are typically and are almost in every Horror Movie.<br /><br />The scenery fits perfect to the story and is close to reality,I can say that honest, because I visit them once when I was in Romania in my Vacations.<br /><br />In my opinion this is the Best Part of the Subspecies Series.",1
"Susan Slept Here turned out to be Dick Powell's swan song as a performer on the big screen. Of course he directed some more films and appeared frequently on television until he died. It's a pity he didn't go out with his performance in The Bad and the Beautiful.<br /><br />Frank Tashlin has done so many better films, I'm still not sure whatever possessed him to do this one. The premise is absolutely laughable. <br /><br />Dick Powell is a screenwriter who's looking to do more serious stuff than the fluff he's been writing. He had an idea for a film on juvenile delinquency so two friendly cops in Herb Vigran and Horace McMahon deposit 17 year old Debbie Reynolds on his doorstep. She's not a really bad kid and they don't want to put her in the system. So they give her to Dick Powell at Christmas time.<br /><br />I mean is there anyone out there who doesn't see a problem? The term jailbait comes immediately to mind. Additionally Powell has a girlfriend, the young and sexy Anne Francis. Why Debbie Reynolds is any competition here is beyond me.<br /><br />Susan Slept Here got one Oscar nomination. The song Hold My Hand, sung by Don Cornell in the background, was nominated for best song, but lost to Secret Love. <br /><br />Powell and Reynolds do have some funny moments together and Alvy Moore as Powell's factotum and Les Tremayne as his lawyer also get a few laughs. <br /><br />But it's not enough.",0
"Secret Service agent Jay Killion (Charles Bronson) has been assigned to protect the President-elect's wife, the new First Lady (Jill Ireland). She is a very difficult woman and Killion has his hands full. She is the victim of numerous assassination attempts, all directed by the President's Chief of Staff, who wants the First Lady dead. This movie insults your intelligence with not only the story line, but also with the lack of realistic locations. For example, in the scene depicting the Inaugural Parade, the First Lady is in a Rolls Royce convertible with agent Killion and without the President. Also, we know what Washington, DC, is like weather wise in January, and not only is everybody ""top coat less"", you can even see some palm trees in the 70 degree and sunny weather! (Obviously filmed in Hollywood, not Washington, DC). This movie is a joke. It is not worth your time.",0
"I got subjected to this pile one Wednesday afternoon when my mother-in-law was watching it. I can't get over someone basically doing a remake of a crappy high budget Hollywood flop (""the CORE"" with washed up actors like Luke Perry). If the HIGH budget one flopped, what makes people think doing the SAME movie 2 years later with NO budget would go anywhere? I was laughing through most of the movie because of how insanely similar it was (in fact I am shocked it's not held up in Legal rather than airing on TV), and how it was basically the script of the CORE just redone badly, which if you have seen ""the Core"", you know why doing it worse is funny, since the CORE was ALREADY so bad it was funny.<br /><br />If you enjoy getting a laugh out of REALLY bad movies, this one will be right up your alley. The only thing I can say, is that I wish Luke Perry was able to have a career, because he isn't a horrible actor.. he just lands horrible roles. Crappy made for TV movies that will only run on daytime television is pretty much one step closer to the end for him, if it wasn't for 90210 he would have a career.",0
"Most people, when they think of expressionist cinema, look to the b&w German films of the silent and early sound eras--films that emphasized canted angles, extreme contrasts of light and dark, exaggerated performance, and occasional uses of surrealism to create a dreamlike atmosphere in order to diverge from traditional, naturalistic modes of cinematic representation. If we're willing to accept that the Germans were not the only filmmakers to create expressionist cinema (and that those above-mentioned characteristics are not prerequisites for expressionist film), then I would argue that Dodes'ka-den (DKD) is a prime example of this type of film. <br /><br />Like Dreams, DKD is a little unhinged for a Kurosawa film, dabbling, as it does, in the unreal. However, DKD is also, unlike Dreams, a great film and probably my favorite Kurosawa picture. Why? Mostly, I think, it's the colors. This was, I believe, Kurosawa's first color film, and the man saturates the movie with vibrant primary colors, creating a completely unreal contemporary Japan. We are used to the neon lights and gleaming Tokyo skyscrapers; we are not used to a city that appears to have been colored with crayons. <br /><br />DKD is, as I said, a peculiar film inasmuch as many of its characters live in a junkyard, appearing to live in an alternate universe. That is, I think, the point--these are the Tokyo outsiders, the people left behind during the great move forward following World War II. The film also represents one of Kurosawa's more heartfelt movies; there is genuine sentiment here and genuine pathos (such as when the boy's father describes their dream home). It's an amazingly moving film from a man better known for stunning, John Ford-like vistas and samurais. Everyone should have known Kurosawa had in him a movie as touching and thought provoking as this (Ikiru foreshadows the emotional resonance of this film in many ways). <br /><br />I will also argue, to the last, that this is Kurosawa's greatest achievement. His samurai films, though capable pictures, pale in comparison to works by Kobayashi (Hara-kiri is the greatest, most intelligent samurai film committed to celluloid). Rashomon, Hidden Fortress, Seven Samurai, Yojimbo, Sanjuro, Kagemusha, and Ran are all fine films, but they're merely good (and, frankly, I think that word is too generous for Hidden Fortress and Kagemusha). DKD is a great movie, as is Ikiru. They are the crown jewels that show Akira was not a one-trick samurai pony. They reveal his artistry and mastery of cinema.",1
"I think its time for Seagal to go quietly into the night. What I have just seen makes all his direct to video releases in the last few years look like his early 90's smash hits in comparison.<br /><br />A secret bio lab is making a new kind of drug that jacks up a human's adrenaline system to the point where they become psychopathic killers or something. Somehow Seagal is supposed to stop the infection or its the end of the world...or something. Seagal also went through hit squads like jellybeans, every time I look up he was commanding a new face so it kinda got hard to follow character development as well I know Steven's athsma prevent him from yelling at the top of his lungs but even so why is he constantly being dubbed by people who sound nothing like him? Usually the films plot and action sequences can save it from being a total waste of time but this was not even close. Like I said, it was more of a horror movie with a lot of blood and shank stabbing rather than straight up fighting. The problem was it wasn't really scary and Seagal looked completely out of place because the infected people were supposed to have speed of light movement yet the 40 year old 280 lb Seagal killed them all singlehandedly? I guess the lone highlight of the movie was the first 20 minutes where the new recruits ask Seagal to come to the strip club with them.<br /><br />2 out of 10",0
