review,sentiment
"This film fails on every count. For a start it is pretentious, striving to be ""significant"" and failing miserably. The script was banal in the extreme, nobody at any time said anything remotely interesting. It was impossible to care about any of the characters. Knightly was a self-regarding waste of time whilst Sienna Miller was just a waste of time. The bit about the soldier who went off to war was a cliché even before the film Atonement used it. The use of the Second World War as a backdrop was in itself a cliché...the bombs, the sheltering in tube stations etc...employed to import a bit of much-needed drama. Why anybody thought for a moment that this film was worth making is quite beyond my comprehension. It was yet another case of ""let's get the costumes looking authentic, never mind about the story, the script or the acting!""",0
"I agree that the movie is a little slow at spots having many scenes of mundane everyday life and no dialog. And I wasn't impressed right after I watched it. However, after a few days, I realized that the movie stays with me and it evokes a melancholy mood which lingers in my mind. My appreciation of this movie increases. It certainly merits a higher consideration than those movies that are instantly forgettable.<br /><br />As many have commented, the movie is non-linear and that's a hallmark of European film-making as opposed to the linear narrative form that Hollywood favors. I don't really know whether it's true or not. Many also dislike its confusing structure and lack of clear explanations. To those viewers, I don't think there is much I can say to change their opinions. However, for others who have yet to see the film, DO expect to be challenged and DON'T expect the film to supply all the answers and you might come away enjoying it more than you would otherwise.<br /><br />The movie skips around a bit but really chronicles just 3 time periods. Pay attention to the hair style and you can easily separate out 2 of the 3 periods. It is also not as confusing as suggested; just enjoy and it'll all be clear at the end.<br /><br />Yes, lots of things are left unsaid or not shown, and lots of situations are left unexplored. But isn't that what life is like? A lot of time you're not sure of the motives of your friends/loved ones unless you confront them and even then, you can never be 100% sure if they told you the whole truth. This type of movies forces us to interpret the reasons behind the actions. The movie does, however, leave enough hints for you to make some reasonable assumptions. For example, Mathieu is manic depressive, to the point of suicidal. Why? I don't know, maybe his life is not turning out exactly as he expects it; maybe he misses his family but hasn't forgiven his father for abandoning his sick mother at her hours of need; maybe after all he sacrifices for Cedric, rearranging and indeed, shattering his life to be with him, he realizes that it is all ""coming undone"". I think the director meant to show us that he has always been a little off, mentality fragile by that scene w/ the dead bird. Maybe he has a very sensitive psyche and all these stresses are taking a toll on him. But we're also shown that he is not some animal torturing psycho by his loving interaction w/ the stray cat. Also, there is one conversation between the doctor and Cedric that sheds light on the reason behind the breakup and maybe the suicide attempt. The doctor asks him if everything is okay, and Cedric thinks so even though he cheated on Mathieu once, but that's nothing, according to Cedric. Is that the only reason, we don't know, there are probably others, all mixed up together. Is it paramount that we know exactly what they are? I don't think so, for this movie. Another telltale sign that they are ultimately not compatible is the historical ruins scene. Mathieu is interested in studying the ruins, Cedric is not. He is the one w/ the raging hormone who focuses only on the physical side without an intellectual side that Mathieu obviously needs.<br /><br />Finally, the ending is really rather hopeful and sweet. I was pleasantly surprised by the turn of events after the bleak tone that edges toward the end.<br /><br />I have two complaints for the DVD. One is the sound. It's very soft. I had to crank up the volume to hear the dialog and then when it switched to a bar or outdoor crowd scene, it became too loud. The other is that the subtitles can't be turn off; they stay on the screen. Most foreign movie DVDs not released by a major studio are shoddy this way unfortunately.",1
"I may be biased, I am the author of the novel The Hungry Bachelors Club, self-published in 1994. The screenplay was written by my good friend and hungry bachelor, Fred Dresch, who was the inspiration for the character Marlon in the film. I couldn't be more pleased with the trailer, I hope to see the film in its entirety and I will further comment. But Jorja Fox, who plays Delmar Youngblood, my character, is stellar. She carries the bulk of the emotional vehicles in fine form. I couldn't have done better myself! This looks like real people, hardly formula driven and thankfully drives my statement against racial prejudice home, gracefully and heartfelt.",1
"I didn't really expect much from ""The Night Listener"" and I actually never heard of it until I saw the cover in the videostore. However, the movie is very effective when it comes to building up suspension and tension. On occasion it drags a little, but it actually helps to keep you wondering what's going to happen and more importantly: when. As the movie progresses, the character played by Robin Williams gets dragged into some kind of ""cat and mouse"" spiel to the point where he becomes obsessed with finding out the truth and existence about a 14 year old abused kid that no-one seemed to have ever seen in person. The Night Listener is an interesting story, which is great in building up the suspense throughout the movie and you're pretty much kept in the dark of who is lying and what's real. However, in the end it kind of disappoints and doesn't live up to the potential it could have had. It doesn't really give you a detailed or plausible explanation about the other main character, which would have been helpful and interesting.",0
"A brilliant Russian émigré devises the Stanislavsky' system for winning at contract bridge - which makes him and his beautiful wife the GRAND SLAM Sweethearts of America.<br /><br />What could have been just another silly soap opera is elevated by fine production values & excellent acting to the status of a very enjoyable little comedy. A few unexpected touches are thrown in to keep the viewer's attention engaged - the way in which the principle cast is introduced as faces on a deck of cards; the introduction of a zany acrobat into the plot for no other reason than to enjoy a bit of lunacy; and the way in which a wide variety of different kinds of Americans are shown to be transfixed by listening to the broadcast of the concluding game.<br /><br />Paul Lukas & Loretta Young do very well as the Bridge Sweethearts - Lukas suave & sophisticated and Miss Young passionately loving and beautiful (even if the script keeps her puffing on a cigarette a bit too much). They are fun to watch, even when their behavior is not always the most believable or compelling.<br /><br />Frank McHugh gives another good performance as a relentlessly cheerful ghost writer who adores Miss Young. The delightful Glenda Farrell eschews her customary wisecracking persona in a small role as McHugh's ditsy gal pal. Roscoe Karns handles the fast-talking dialogue as a brash radio announcer. Diminutive Ferdinand Gottschalk is wonderful as a snobbish bridge expert.<br /><br />Movie mavens will recognize Dewey Robinson as a belligerent nightclub patron; Emma Dunn as a sob sister reporter; Paul Porcasi as the owner of the Russian nightclub; Charles Lane as a Russian waiter; and Jimmy Conlin as a kibitzer at the final bridge game - all uncredited.<br /><br />The film takes advantage of the fad for contract bridge which had swept across the country since its development in the 1920's. It expects the viewer to have a basic knowledge of the intricacies of the game and makes no attempt to explain anything to the uninformed.",1
"Just saw the World Preem of Fido at the Toronto International Film Festival and thoroughly enjoyed it. Here we have a welcome reworking of a genre widely thought to have been pioneered (certainly 'fleshed out' extensively and successfully) by George Romero. But this is a Canadian film by a Canadian Director and it's a Comedy! And, YES, I actually think it is better than 'Shawn of the Dead'. Thoroughly believable and, perhaps even more importantly, enjoyable performances by Dylan Baker, Carrie-Anne Moss and young actor K'Sun Ray, whom I suspect we'll be seeing a lot more of in future features. However, I must confess that I most enjoyed the delicious turn by Tim Blake Nelson as neighbour Mr. Theopolis, essentially playing a willing animated version of Victor Van Dort from the Corpse Bride (or, for those who've seen the film, wouldn't that read even better here as the Corpse Pride?) and, of course, Scotch actor Billy Connolly in his least animated, yet somehow deeply moving role as the titular character. Just think, he would not have gotten this role had it not been for Peter Stormare's commitments to Prison Break (as was revealed in the Q&A following Thursday night's screening). I can't help but speculate that the Screenwriters must have drawn a lot of inspiration from Day Of The Dead's Zombie 'Bub'.I am not keen on ever revealing plot details during a Comment and I won't start now. Suffice it to say that Fido is NOT one of those dour, graphically gory Zombie films you can rely on from Romero. Rather it is a film that will have you constantly chuckling and, although (and I did have to think back carefully to be sure) there is a fair dose of blood-letting and violence, the delectable humour, so well enhanced by the surreal milieu created by Director Currie and his co-screenwriters, goes a long way towards making this seem like a feature that ought to be rated PG-13. I urge you to go see this little Canuck gem. I'll certainly be buying the DVD once it emerges hopefully by next Summer.",1
"I am a big fan of Fred MacMurray and Carole Lombard. And, in addition to them, Charles Butterworth (a very enjoyable supporting actor) was in this film,...so why didn't I particularly enjoy it?! Well, despite a good cast, this is one of the poorest written and most clichéd ""A pictures"" I have ever seen. Given the talent and money spent to make this film, it is shocking how slip-shod the writing was. I knew the film would be tedious when time after time early in the film I found myself predicting EXACTLY what would happen next--and I was always right! And this isn't because I am some sort of ""movie savant"", but was because almost no imagination or effort went into it. In fact, it seemed almost as if the film was just a long string of clichés all strung together! Also, I found it a bit irritating that Fred mistreated Carole so bad throughout the film and yet, true to convention, she came running to him in the end. Uggh! There is MORE suspense in a Lassie film (""will he bring people to rescue Timmy or will the rope he is dangling from break?"").<br /><br />Despite the very, very tired and clichéd script, there were a few positives about the film. It was pretty cool seeing Fred look like a broken lush at the end of the film--it was pretty believable and he looked like he hadn't eaten, shaved or slept in days. Also, Charles Butterworth's ""prattle"" did provide a few mildly humorous moments. But all this just wasn't enough to make this film look any different than a ""B movie"". It's a shame,...it could have been so much better.",0
"This is the last time I rent a video without checking in at the IMDB reviews. The Limey is directed by Steven Soderbergh who also wrote wrote the truly awful Nightwatch with Ewan Macgregor and directed such trash as Out of Sight with the anti-talented Jennifer Lopez. Terence Stamp is a fine actor and it is a shame he involved himself in such a bad film. There is frequent confusing editing that seems like it was a last minute decision in order to make up for the lack or story, filming and just plain common sense. This film does everything wrong. What were they thinking?",0
"Originally aired as an ABC Movie of the Week. This involves two young innocent female college students who are railroaded into a prison camp in a little Southern town. They aren't allowed phone calls and nobody knows they're there. What follows is rape, torture, beatings, humiliation and degradation leading to a very disturbing conclusion.<br /><br />The TV version was (for its time) grim. No nudity and the beatings were pretty tame but the overall feeling of sleaziness wore one down. The unrated version is even worse--there's plentiful nudity, the violence is extreme and, in one particularly disgusting sequence, we see a crying female prisoner forced to strip while a lesbian guard ""uses"" her. YUCK! There's nothing wrong with exploitation films but this one just goes over the brink. You get the feeling that the filmmakers enjoy having these poor women being tortured and degraded--all this is shoved in your face like you're supposed to enjoy it. The needlessly downbeat ending doesn't help.<br /><br />I'm giving it a 3 because the acting is good--but that actually makes the movie harder to watch. A sick, sleazy film. Not recommended.",0
"Let me say this about Edward D. Wood Jr. He had a passion for his work that I wish more people did have. If we all had the optimism and the commanding hope of Ed Wood, the world would probably be a much better place. Being familiar with Ed Wood's story and having seen the most wonderful biopic ""Ed Wood"" (1994) several times, I admire his boldness and his strives for the job he loved; I still admire his never-say-die attitude. He had a love for directing that I wish more people in modern-day Hollywood had.<br /><br />But that doesn't make his movies any more fun to watch. And ""Glen or Glenda,"" his first and most confessional film, is probably his very worst.<br /><br />""Glen or Glenda"" is a deadening cult movie about a cross-dresser named Glen (played by director/writer Ed Wood himself) who despite his love for his fiancée Barbara (Dolores Fuller), cannot seem to conquer his lust for transvestitism, in which he dresses in women's clothing and a wig and thus becomes...Glenda! Glen/Glenda's story is narrated by a doctor and he too is talked and watched over by a mysterious character called ""The Scientist"" played by veteran horror star Bela Lugosi. Oh, and there's also some sub-story about an Alan/Anne character who becomes a transsexual based on the Christine Jorgenson story, upon whom this movie originally titled ""I Changed My Sex!"" was previously to be based.<br /><br />Have I dropped your jaw yet? Well, as much as I want to warn you off this picture if you've never seen it, I would never tell a lie about a movie and there is not one word of falsehood in that plot synopsis I just gave you. Every thing in it is true. This is a movie about cross-dressers and transsexuals, a topic that does not sound very appealing to begin with and is not done in a very appealing manner. I'm sure that with a good screenplay, and a good director (it had neither) that ""Glen or Glenda,"" despite the subject matter, could have been a very moving picture. It is a confessional movie on Wood's part, as he was a transvestite in real life as well as on screen. But once again, that does not make it a good movie...or a watchable one for that matter. ""Glen or Glenda"" is a jumbled, disorganized mess of a movie that sinks into new trenches in the realm of bad cinema. It makes no more sense than does its notoriously silly scene where Bela Lugosi screams ""Pull the string!"" over inexplicable footage of stampeding bison. The majority of the movie is narrated in a monotonous voice, reminding me of some very bad short informative films I've seen before. It's like one of those really bad short films expanded into a seventy-minute feature and twice as dull. We sit there for ages waiting for the plot that never comes. There is no real attempt to even build energy with the camera being locked down in one position for many grueling minutes and long stretches of time where nothing at all happens. The only moments that are worth anybody's time are those of Bela Lugosi who manages to bring some light into these dark trenches. I guess Lugosi is supposed to be like the deity of the film, but personally, I couldn't care less who or what he's supposed to be. I'll tell you what he was: A gifted actor who wound up making trash. But he and Wood were very good friends and liked working with each other, so good for him.<br /><br />I will always admire Edward D. Wood Jr. for his passion for the cinema, but I will never as long as I live admire his movies. A film critic once called Ed Wood's movies ""innocent fun"" but I think even that is questionable. Innocent? Yes. Fun? No, sir. And if ""Citizen Kane"" is the Mount Everest of the cinematic world, then ""Glen or Glenda"" is probably the Mariana Trench.",0
"It is like what the title of this thread say. Only impression I got from that movie is that Marlee Matlin's character was always angry, so cynical, and so pathetic. Her character's first date with William Hurt's character where they were dancing were dumb. All in all, I've tried to finish watching the movie four times, and of all four times I fell asleep. I would keep watching that movie with one intention... to beat my problem with insomnia, because all it do is to put me to sleep. Sweet dream.",0
"Just as Tom Berenger put you into the soul of Sgt. Barnes, he has done it again with Thomas Beckett. If I thought his world was folding in on him in the first scenes, it was nothing compared to how much more I felt during the last scenes. Great movie, even for a girl.",1
I saw this movie with very low expectations. I didn't know a lot about it so I wasn't sure if it was going to be worth it.<br /><br />The story did an OK job of getting you curious about these ruins they travel to. The suspense continues when the Mayans show up and force them to stay at the ruins.<br /><br />Then the movie turns from somewhat suspenseful to pointless. The amount of gore found in this movie did not balance out compared to whether it was truly necessary or used more for shock value.<br /><br />The fact that they didn't make any attempt to fight the vines from hell. They had fire and didn't try to burn it nor did they try to cut it with a knife to see if they could destroy it or not. They quickly jumped into a victim role and their helpless attitude was not real. It reminded me of the old horror movies where the people just scream and yell and don't have half a brain to try to fight back.,0
"I am writing this with 10 minutes left before the film finishes. I feel comfortable writing it now, because unfortunately I know exactly how this film is going to end.<br /><br />The premise is simple enough, rabid dog on the loose in a small town, kills people. Great - simple plot for a good fun camp 80s horror.<br /><br />Uhh ..no.<br /><br />The main problem is this is based on a book (Stephen King) and you can tell that is should not have really been adapted to film, at least not with the same plot. Why? Cuz its boring! The first 45 minutes tries to build depth to its main characters and create suspense. It however lasts too long (half the film!) - the characters are unlikeable and we never care for them anyway, and it just about creates zero suspense. The easiest film (according to plot and time) to compare this to it the classic Jaws. Everything that Jaws does right, Cujo does wrong. Jaws created good characters and a genuine feeling of dread. Cujo does neither. Jaws effectively creates a scary, creepy villain in its shark. Cujo has a dirty St Bernard running about growling and jumping, and not a lot else. Jaws is exciting and unpredictable. Cujo is a tireless bore that remains predictable right to the end.<br /><br />Also confusing is the plethora of subplots that just act as boring red herrings to the films main plot.<br /><br />If this film was rewritten for the big screen and had a better director this could have been good. But it wasn't. It was a waste of 90 minutes of my life.<br /><br />People on here are saying this is one of the best King adaptations - Im sorry you could not be more wrong. The Mist is a hundred times better, Thinner is 10 times better and even the one with the cats is twice as good! This in my opinion is one of the worst! The only good thing was the action scenes with the dog looked real, even though they were dull.<br /><br />Films ended now, and it didn't get any better. Avoid.",0
"In this unlikely love triangle, set in 19th century Italy, `The Beauty and the Beast' is being turned upside down and inside out and then some: Giorgio, an army officer and the very image of male beauty, is being transferred away form his (married) lover Clara and sent to a small garrison somewhere in Piemont. There - initially much to his horror  Fosca, the grotesquely ugly cousin of his commander, develops an obsessive love for him. He suffers her passionate and demanding displays of affection out of pity and concern for her health (she is gravely ill), but becomes more and more fascinated by her  until the dramatic finale<br /><br />Do not miss this most unusual love story, as twisted as it may sound. Valeria d'Obici, who deservedly won a price for her portrayal of Fosca, is as alarming as she is touching. Buy the video, read the book, go see the musical!",1
"*** Spoiler in fifth paragraph *** This was an amazingly frank (uh-huh, uh-huh) picture for 1955. Otto Preminger and Carlyle Productions took a chance by making it, the Motion Picture Association of America balked at certifying a film that openly shows a junky jabbing a syringe full of heroin into his arm. Frank Sinatra took a chance both on playing an addicted musician and at falling flat on his face in a role that required at least twice as much acting as he'd ever done. All in all these gambles paid off, the movie is a classic, though it's not perfect.<br /><br />Nelson Algren's novel may be great, but it has far too much going on to fit comfortably into a two hour movie 'The Man with the Golden Arm' is 119 minutes and often feels much longer. However, in my opinion it's not just Frankie Machine (Sinatra) that makes the film but the other characters and their sub-plots, all involving Frankie. Ultimately it's not just Frankie who has the addiction, everyone and everything seems to be dependent on him and he feels it keenly. When the pressure gets to be too much the drums start pounding on the soundtrack and Frankie steps across the street with his well-dressed ""friend"" Louie.<br /><br />It's an exaggeration to say that Frank Sinatra's music career was ever really in the doldrums, but in the early 50's he was in limbo between his days touring with big bands and the Las Vegas era. 'From Here to Eternity' established him as a serious actor and his career as a singer rebounded as well, but 'The Man with the Golden Arm' was still a significant challenge, the whole show sinks or swims with his performance. He pulls it off with such skill that for several minutes at a time I forgot I was watching Frank Sinatra, he must have known junky musicians and exploited that knowledge to the utmost.<br /><br />Set side by side with Billy Wilder's masterpiece 'The Lost Weekend' there is more emphasis on the sociological causes of addiction in 'The Man with the Golden Arm.' Whereas Don Birnem (Ray Milland in 'The Lost Weekend') seems to struggle mostly against himself, Frankie Machine is beset by external forces and he takes refuge in the needle. Neither approach is wholly right or wrong, mostly because addiction is impossible to fully explain, but it seems like this film might have benefited from a little more insight into Frankie's internal struggle.<br /><br />*** Spoiler *** One of the problems I have with this film is the clichéd reliance on ""quitting cold turkey."" I realize that 'The Man with the Golden Arm' was probably setting the trend rather than following it but that doesn't make it any better. In the beginning of the movie Frankie has to all appearances kicked his habit with the help of a doctor and a treatment facility of some sort. Naturally the drama of the film requires that he backslide, but I found the All-American ideal that a man has to face his problems alone (or maybe with the help of a good woman) out of place here. Going cold turkey and riding off into the sunset with Kim Novak seemed too unrealistic. The end of 'The Lost Weekend' was similar but in my opinion was a little less rosy.",1
